	en	pl	de	fr	zh	pt	ru	es
EnemyStrengthWeak_01	As they are few in number, enemy forces should not pose a challenge in this region.	Siły wroga nie będą wyzwaniem.	Die feindlichen Kräfte stellen keine Herausforderung dar.	Les forces ennemies ne seront pas un défi.	敌军不构成威胁。	As forças no inimigo não apresentarão nenhuma dificuldade.	Вражеские силы не будут представлять угрозу.	Las fuerzas enemigas no serán ningún reto.
EnemyStrengthWeak_02	We have detected very few enemy fleets in this area.	W okolicy jest bardzo niewiele flot wroga.	In der Umgebung gibt es nur wenige feindliche Flotten.	Il y a très peu de flottes ennemies dans la région.	该地区几乎没有敌军舰队。	Nas proximidades há muito poucas frotas inimigas.	В окрестностях небольшое количество вражеских флотов.	En las proximidades hay pocas flotas del enemigo.
EnemyStrengthWeak_03	We have analyzed the enemy’s firepower in this region and found no reason to be worried.	Po analizie sił wroga, nie mamy powodu, by się martwić.	Nachdem wir die feindlichen Kräfte analysiert haben, sehen wir keinen Grund, uns Sorgen zu machen.	Après avoir analysé les forces ennemies, nous n’avons aucune raison de craindre.	在分析了敌人的火力后， 我们没有理由担心。	Depois de analisar as forças do inimigo, não temos motivos para nos preocuparmos.	После анализирования сил врага у нас нет повода для беспокойства.	Después de analizar las fuerzas del enemigo, no tenemos ningún motivo para preocuparnos.
EnemyStrengthWeak_04	Enemy forces in this area are sparse; they should pose no threat to your fleet.	Siły wroga na tym obszarze są nieliczne, nie powinni stanowić zagrożenia.	Auf dem Gebiet gibt es nur vereinzelte feindliche Kräfte, sie stellen keine Gefahr dar.	Il y a très peu de forces ennemies dans la région, elles ne devraient présenter aucun danger.	该地区的敌军稀少， 他们应该不构成威胁。	As forças do inimigo nesta zona são escassas, não vão ser um perigo.	Вражеские силы в этом районе немногочисленны и не должны представлять угрозу.	Las fuerzas en esta área son pocas, pero no deben de ofrecer ningún peligro.
EnemyStrengthWeak_05	Japan’s naval presence in these waters is inconsiderable. You are unlikely to encounter many of their forces.	Siły japońskie nie wydają się być liczne w tym regionie - nie powinieneś napotkać ich zbyt wielu.	Die japanischen Kräfte sind nicht besonders zahlreich in dieser Region vertreten - du wirst nicht auf allzu viele stoßen.	Les forces japonaises ne semblent pas nombreuses dans cette région - vous ne devriez pas en rencontrer trop.	日本军队在这个地区似乎没有太多的存在感  ——  你应该不会遇到太多麻烦。	As forças japonesas não parecem ser numerosas nesta região: não vamos encontrar muitas.	Японские войска не кажутся многочисленными в этом регионе – Вы не должны столкнуться со слишком большим их количеством.	Las fuerzas japonesas no parecen numerosas en estas región: no debe de encontrar muchas de ellas.
EnemyStrengthMediumLow_01	While there are some hostile fleets in this region, we don’t expect them to be too much of a problem.	W tym regionie są floty wroga, ale nie powinny spowodować zbyt wielu problemów.	In dieser Region gibt es feindliche Kräfte, sie sollen aber nicht allzu viele Probleme bereiten.	Il y a des flottes ennemies dans cette région, mais elles ne devraient pas causer trop de problèmes.	这个地区有一些敌方舰队， 但应该问题不大。	Nesta região há frotas inimigas, mas não vão provocar muitos problemas.	В этом регионе есть флоты врага, но они не должны создать слишком много проблем.	En esta región hay fuerzas enemigas, pero no deben de provocar muchos problemas.
EnemyStrengthMediumLow_02	Enemy ships have been spotted in the area, but their numbers do not present considerable danger.	W okolicy zauważono trochę statków wroga, ale nie powinny stanowić prawdziwego zagrożenia.	In der Umgebung wurden einige feindliche Schiffe gesichtet, aber sie sollen keine wahre Gefahr darstellen.	On a aperçu quelques navires de l’ennemi dans la région mais ils ne devraient présenter aucun danger.	在该地区发现了许多敌舰， 但他们应该不构成真正的威胁。	Nas proximidades avistámos alguns navios inimigos, mas não vão ser realmente perigosas.	В окрестностях замечено небольшое количество кораблей врага, но они не должны представлять собой настоящую угрозу.	En el área se han detectado algunos buques del enemigo, pero no deben de ser ningún gran peligro.
EnemyStrengthMediumLow_03	Japan has a small number of fleets around this location, but they shouldn’t be enough to hinder our operations.	Japonia ma niewielką liczbę flot wokół tej lokalizacji, ale nie powinny być wystarczające, by cię powstrzymać.	Japan hat eine kleine Anzahl von Flotten auf diesem Gebiet, aber sie reichen nicht aus, dich aufzuhalten.	La Japon dispose d’un certain nombre de flottes autours de cet endroit, mais elles ne devraient pas être suffisantes pours vous arrêter.	日本在这个位置附近有少量舰队， 但这应该不足以阻止你前进。	Japão tem uma pequena quantidade de frotas ao redor esta localização, mas vão ser suficientes para nos deter.	У Японии небольшое количество флотов вокруг этого места, но их не должно быть достаточно, чтобы остановить Вас.	Japón tiene un pequeño número de flotas alrededor de esta localización, pero no deben de ser suficientes para pararle a usted.
EnemyStrengthMediumLow_04	Some hostile forces are known to be in this area, but not so many that you should have cause for concern.	Wiadomo, że w okolicy przebywa kilku wrogów, ale nie jest ich tak wielu, aby stanowili powód do obaw.	Es ist bekannt, dass es in der Umgebung einige Feinde gibt, aber es gibt von ihnen nicht so viele, dass man sich Sorgen machen muss.	On sait qu’il y a quelques ennemis dans la région, mais lur nombre n'est pas suffisant pour présenter un danger.	已知一些敌人在该地区， 但他们的数量并不多， 因此不用过多在意。	Sabemos que nas proximidades há vários inimigos, mas não numerosos o suficiente para nos preocuparmos.	Известно, что в этом районе находится несколько врагов, но их не так много, чтобы они представляли собой повод для беспокойства.	Se sabe que en las proximidades hay varios enemigos, pero no son muchos y no van a ser ningún peligro.
EnemyStrengthMediumLow_05	This region is patrolled by enemy fleets, but their numbers are not high enough to pose a serious threat.	Region jest patrolowany przez kilka wrogich flot, ale ich liczba jest zbyt niska, by stanowić poważne zagrożenie.	Die Region wird durch feindliche Flotten patrouilliert, aber ihre Anzahl ist zu klein, um eine ernste Gefahr darzustellen.	La région est patrouillée par quelques flottes ennemies mais leur nombre n’est pas suffisantes pour présenter un danger.	该地区有一些敌方舰队在巡逻， 但数量太少， 不足以构成严重威胁。	A região está a ser patrulhada por várias frotas inimigas, mas a sua quantidade é demasiado pequena para nos oferecer um perigo.	Регион патрулируется несколькими вражескими флотами, но их численность слишком низкая, чтобы они представляли собой угрозу.	La región está siendo patrullada por varias flotas enemigas, pero su cantidad es demasiado baja para que constituyan un verdadero riesgo.
EnemyStrengthMediumHigh_01	The amount of enemy forces in this area is concerning, but you should still be able to defeat them.	Na tym obszarze znajduje się pewna liczba wrogów, ale powinieneś być w stanie ich pokonać.	Auf diesem Gebiet gibt es einige feindliche Formationen, aber du wirst im Stande sein, sie zu schlagen.	Il y a in certain nombre d’ennemis dans cette région mais vous devriez pouvoir les vaincre.	该地区有相当数量的敌军， 但你应该能够击败他们。	Nesta zona encontra-se certo número de inimigos, mas vamos poder vencê-los.	В этом районе находится определенное количеств врагов, но Вы должны быть в состоянии побороть их.	En esta zona se encuentra cierto número de enemigos, pero va a conseguir vencerlos.
EnemyStrengthMediumHigh_02	A large number of enemy forces have been spotted around this location, but with a good strategy you should be able to get out unscathed.	W pobliżu tego miejsca zauważono wiele flot wroga, ale dzięki dobrej strategii powinieneś wyjść z tego bez szwanku.	In der Nähe dieses Orts wurden viele feindliche Flotten gesichtet, aber du sollst, dank einer guten Strategie, unbeschädigt davon kommen.	On a aperçu de nombreuses flottes ennemies dans cette région mais vous devriez s’en sortir indemne.	在这个位置附近发现了大量的敌方舰队， 但如果有好的策略， 你应该能够毫发无损地离开。	Nas proximidades avistaram-se muitas frotas do inimigo, mas graças a uma boa estratégia poderemos sair da situação sem perdas.	Вблизи этого места замечено множество вражеских флотов, но благодаря хорошей стратегии Вы должны выйти из этой ситуации без потерь.	En las proximidades de este lugar se han avistado muchas flotas enemigas, pero gracias a una buena estrategia, va a salir del combate sin daños.
EnemyStrengthMediumHigh_03	The enemy’s numbers in this area are considerable, but not unbeatable.	Liczebność wroga w tym rejonie jest znaczna, ale nie jest nie do pokonania.	Die Zahl der feindlichen Kräfte in dieser Region ist erheblich, aber sie sind nicht unbesiegbar.	L’ennemi est nombreux dans cette région mais il n’est pas à vaincre.	该地区的敌人数量可观， 但并非不可战胜。	O inimigo é muito numeroso nesta região, mas não é impossível combatê-lo.	Численность сил врага в этом районе значительна, но его можно побороть.	El enemigo es numeroso en esta zona, pero no es imposible vencerlo.
EnemyStrengthMediumHigh_04	Japan has a fairly high number of fleets here, but your strike group should be fine if they don’t group up.	Japonia ma na tych wodach sporą liczbę flot, ale o ile się nie zgrupują, twoja grupa uderzeniowa powinna sobie poradzić.	Japan hat auf diesen Gewässern zahlreiche Flotten, aber solange sie sich nicht zusammenschließen, wird deine Sturmgruppe im Stande sein, sie zu schlagen.	Le Japon dispose d’une grande flotte dans ces eaux mais si elle ne se regroupe pas, votre groupe aéronaval devrait s’en débrouiller.	日本在这些水域有相当数量的舰队， 但除非他们围攻你的攻击群， 否则应该没问题。	Nestas águas Japão tem uma quantidade importante de frotas, mas se não se reunirem, o seu grupo de ataque vai poder combatê-las.	В этих водах у Японии высокая численность флотов, но если они не сгруппируются, Ваша ударная группа должна справиться.	Japón tiene un número considerable de flotas en estas aguas. Si no es juntan, su grupo de ataque va a poder vencerlos.
EnemyStrengthMediumHigh_05	The enemy’s numbers in this region are fairly large, but you should be safe if you remain vigilant.	Liczby wroga w tym regionie są dość duże, ale jeśli będziesz ostrożny, powinieneś być bezpieczny.	Die feindlichen Kräfte in dieser Region sind relativ stark, aber wenn du vorsichtig bist, wirst du sicher sein.	Le nombre d’ennemi dans cette région est élevé mais si vous êtes prudent, vous devriez être en sécurité.	这片区域的敌人数量相当多， 但如果你多加留意的话应该没问题。	As tropas inimigas na região são bastante numerosas, mas mantendo cuidado permanecerá seguro.	Численность сил врага в этом регионе довольно высока, но если Вы будете осторожны, то должны быть в безопасности.	Los números del enemigo en esta región son bastante elevados, pero va a poder salvarse si mantiene cuidado.
EnemyStrengthStrong_01	The enemy’s forces in the region are overwhelming. Proceed with utmost caution.	Siły wroga w regionie są przytłaczające, postępuj ostrożnie.	Die feindlichen Kräfte in dieser Region sind überwältigend, sei bitte vorsichtig.	Les forces ennemies dans cette région sont accablantes, soyez prudent.	该地区的敌军势不可挡， 请谨慎行事。	As forças do inimigo na região são esmagadoras, aja com cuidado.	Вражеские силы в регионе имеют численное превосходство, действуйте осторожно.	Las fuerzas enemigas son aplastantes, mantenga cuidado.
EnemyStrengthStrong_02	We are greatly outnumbered by hostile forces in this area. Be sure to keep an eye out.	Jesteśmy w dużej mierze przytłoczeni przez wroga w tym obszarze, więc bądź uważny.	Der Feind ist uns auf diesem Gebiet zahlenmäßig überlegen, also bleib achtsam.	Nous somme largement accablés par l’ennemi dans cette région, soyez prudent.	我们在这个地区的敌人数量远远超过我们， 所以要小心。	Estamos a ser dominados pelo inimigo nesta região, mantenha cuidado.	Враг в значительной степени имеет численное превосходство над нами в этом районе, поэтому будьте осторожны.	El enemigo tiene una gran ventaja sobre nosotros en esta área, entonces tenga cuidado.
EnemyStrengthStrong_03	There is a significant amount of Japanese fleets around here, so you must be careful.	W pobliżu znajduje się ogromna liczba japońskich flot, należy zachować ostrożność.	In der Nähe befindet sich eine große Anzahl japanischer Flotten, man soll vorsichtig sein.	Il y a une grande nombre de flottes japonaises dans cette région, il faut rester prudent.	周围有大量日本舰队， 小心。	Nas proximidades há um grande número de frotas japonesas, deve manter cuidado.	Поблизости находится огромное количество японских флотов, поэтому следует быть осторожным.	En las proximidades hay un gran número de flotas japonesas. Hay que tener cuidado.
EnemyStrengthStrong_04	The enemy has amassed large numbers of its forces in this area. You should proceed with caution.	Wróg zgromadził na tym obszarze ogromne siły - postępuj ostrożnie.	Der Feind hat auf diesem Gebiet große Streitkräfte gesammelt - sei bitte vorsichtig.	L’ennemi a accumulé dans cette zone des forces énormes, soyez prudent.	敌人在这片区域积累了巨大的力量 —— 谨慎行事。	O inimigo reuniu uma forças enormes nesta região, aja com cuidado.	Враг собрал огромные силы в этом районе – действуйте осторожно.	El enemigo ha agrupado unas grandes fuerzas en esta región. Proceda con cautela.
EnemyStrengthStrong_05	The Japanese navy has numerous ships in these waters, which may prove to be problematic.	Japonia ma w tym rejonie liczne okręty, które mogą okazać się problematyczne.	Japan hat in dieser Region zahlreiche Schiffe, die sich als problematisch erweisen können.	Le Japon dispose de nombreux navires dans cette région qui peuvent présenter un problème.	日本在该地区有许多船只， 他们可能会给你制造麻烦。	Nesta região, os navios do Japão são numerosos e podem resultar problemáticos.	У Японии множество судов в этом районе, это может доставить проблемы.	Japón tiene en esta región unos numerosos buques, que pueden ser problemáticos.